{"acceptance":{"behaviors":["Every frozen operator command parses and reaches a real handler through the shared registration seam","Duplicate core command registration fails during parser construction","Success and failure output obey the frozen JSON and exit-code contract","The runtime wheel contains no Build Fabric tooling, state, browser/provider implementation, or helios-build entry point","Existing helios-p0, helios-p1a, and helios-engine entry points remain exact","Build Fabric source has no runtime database imports or P0/P1A table authority","The README documents finite local and external operation without claiming unavailable providers"],"commands":[{"argv":["/usr/bin/env","PYTHONPATH=../src:..","python3","-m","unittest","tests.test_build_cli","tests.test_build_package_boundary","tests.test_build_authority_boundary","-v"],"command_id":"TASK9_FOCUSED","cwd":"tools","expected_exit_code":0,"gate":"FOCUSED","timeout_seconds":600},{"argv":["/usr/bin/env","PYTHONPATH=../src:..","python3","-m","unittest","tests.test_build_contracts","tests.test_build_store","tests.test_build_graph","tests.test_build_preflight","tests.test_build_dispatch","tests.test_build_review_integration","tests.test_build_external_sessions","tests.test_build_cli","tests.test_build_package_boundary","tests.test_build_authority_boundary","-v"],"command_id":"TASK9_AFFECTED_INTEGRATION","cwd":"tools","expected_exit_code":0,"gate":"AFFECTED_INTEGRATION","timeout_seconds":600}]},"base_commit_sha":"6972551269bcb3d42d2c60c63d326cd6befac356","budgets":{"affected_integration_seconds":600,"cost_microusd":0,"focused_test_seconds":600,"implementation_seconds":7200,"maximum_correction_rounds":2,"milestone_seconds":1200},"capability":"Complete the repository Build Fabric operator CLI, documentation, package exclusion, and authority boundary.","capability_id":"BUILD_FABRIC_CORE_CODE","checkpoint_boundaries":["TASK9_RED_CAPTURED","TASK9_GREEN_CAPTURED"],"conditions":{"block":[{"action":"Block acceptance until package exclusion is proven.","code":"PACKAGE_BOUNDARY_UNPROVEN","when":"The clean wheel includes Build Fabric code, state, or an entry point."}],"escalation":[{"action":"Escalate for task split or redesign without another blind test loop.","code":"CORRECTION_BUDGET_EXHAUSTED","when":"Two substantive correction rounds do not satisfy the frozen acceptance behavior."}],"reroute":[{"action":"Create an explicit successor task and assignment; never relabel another worker's output.","code":"ASSIGNED_SESSION_UNAVAILABLE","when":"The identified external builder cannot complete the bounded task."}],"stop":[{"action":"Stop the task and reject the patch.","code":"AUTHORITY_BOUNDARY_BREACH","when":"The patch imports runtime authority code or changes P0/P1A data surfaces."}]},"correction_round":0,"created_at":"2026-09-01T16:23:52Z","created_by_profile_id":"codex-control-v1","deliverables":["A working repository-local Build Fabric CLI","Operator documentation for finite execution and evidence custody","Proof that Build Fabric code and state are excluded from the runtime wheel","Proof that Build Fabric cannot import or write P0/P1A authority surfaces"],"dependency_node_ids":[],"evidence_threshold":0,"frozen_interfaces":["python -m tools.helios_build doctor [--adapter-config PATH]","python -m tools.helios_build graph status","python -m tools.helios_build task validate TASK","python -m tools.helios_build dispatch TASK --adapter-config PATH","python -m tools.helios_build collect TASK","python -m tools.helios_build review TASK --adapter-config PATH","python -m tools.helios_build integrate TASK [--commit-sha SHA]","python -m tools.helios_build external-session begin TASK --worker-profile PROFILE --provider PROVIDER --session-id SESSION --role BUILDER|REVIEWER --routing-reason REASON","python -m tools.helios_build external-session import-handoff TASK --assignment SHA --handoff PATH --patch PATH --raw-evidence PATH","python -m tools.helios_build external-session import-review TASK --assignment SHA --review PATH --raw-evidence PATH","python -m tools.helios_build report","Exit codes: 0 success, 2 contract or usage, 3 blocked or unavailable, 4 failed, 5 outcome unknown","All stdout is compact sorted JSON and all errors are compact structured JSON on stderr"],"node_type":"BuildTask","ownership":{"files":["tools/helios_build/__main__.py","tools/helios_build/cli.py","build_control/README.md","tests/test_build_cli.py","tests/test_build_package_boundary.py","tests/test_build_authority_boundary.py"],"forbidden_paths":[".github/**","alembic/**","build_control/graph/**","build_control/schemas/**","build_control/tasks/**","build_control/worker_profiles/**","pyproject.toml","src/**"],"migrations":[],"modules":["tools.helios_build.__main__","tools.helios_build.cli"],"path_globs":[],"public_interfaces":["tools.helios_build.cli.CommandConfigurer","tools.helios_build.cli.CommandHandler","tools.helios_build.cli.main","tools.helios_build.cli.register_command"],"schemas":[]},"protocol":"helios.build.task-manifest/v1","required_source_packet_ids":[],"required_source_record_ids":[],"resume_from_checkpoint_sha256":null,"roles":{"builder_profile_id":"codex-builder-v1","integrator_profile_id":"codex-control-v1","reviewer_profile_id":"codex-reviewer-v1"},"schema_impact":[],"supersedes_task_manifest_sha256":null,"task_id":"task-9-build-fabric-core-code"}