{"acceptance":{"behaviors":["The unchanged v1 engine pack digest and migration 017 digest remain exact","A strict full-spectrum Division 23 v2 semantic pack compiles to order-independent canonical bytes and SHA-256 identity","All fourteen definition kinds and ten relation kinds carry resolved per-assertion citations","The five reserved executable arrays are present and empty; non-empty executable content fails closed in B1","A dedicated SQLite EngineStore creates exactly seven v2 user tables and rejects P0, P1A, v1, and unknown schemas","Canonical pack bytes are authoritative, immutable, idempotently imported, reopenable, and queryable by source, definition, relation, neighbor, and citation","Pack supersession is pack-level, same-code, earlier-version lineage and never an in-pack relation","Projection deletion and rebuild reproduce exact indexes while appending one chained event","Migration, blob, projection, citation, endpoint, and event tampering fails closed","The wheel packages v2 schema and migration resources while excluding Build Fabric code and state","Filtered projection queries validate and execute in one stable read snapshot under concurrent writers","Every projection rebuild advances an operation-bound generation shared by all rebuilt rows and its chained event","Same-code strictly-earlier supersession lineage is enforced by public import, direct SQL trigger, load, and integrity verification"],"commands":[{"argv":["/usr/bin/env","PYTHONPATH=../src:..","python3","-m","unittest","tests.test_engine_v2_registry_spine","tests.test_package_metadata","-v"],"command_id":"DIV23_V2_REGISTRY_FOCUSED","cwd":"tools","expected_exit_code":0,"gate":"FOCUSED","timeout_seconds":600},{"argv":["/usr/bin/env","PYTHONPATH=../src:..","python3","-m","unittest","tests.test_engine_v2_registry_spine","tests.test_engine_acceptance","tests.test_engine_cli","tests.test_engine_domain_pack_compiler","tests.test_engine_domain_pack_repository","tests.test_engine_evaluator","tests.test_database","tests.test_package_metadata","-v"],"command_id":"DIV23_V2_REGISTRY_AFFECTED","cwd":"tools","expected_exit_code":0,"gate":"AFFECTED_INTEGRATION","timeout_seconds":600}]},"base_commit_sha":"8ac56eba20004e4a93866b11e8e3b97ae7da8869","budgets":{"affected_integration_seconds":600,"cost_microusd":0,"focused_test_seconds":600,"implementation_seconds":7200,"maximum_correction_rounds":1,"milestone_seconds":1200},"capability":"Integrate the usable database-first Division 23 v2 registry with snapshot-consistent queries, operation-attested projection generations, and independently enforced supersession lineage.","capability_id":"DELIVERABLE_B_DIV23_V2","checkpoint_boundaries":["REGISTRY_HARDENING_GREEN"],"conditions":{"block":[{"action":"Block acceptance; do not label fixture content production knowledge.","code":"PRODUCTION_SOURCE_CLAIM","when":"The bundled TEST_FIXTURE source is described as verified or production-authoritative."}],"escalation":[{"action":"Report the exact failing behavior and redesign once; do not enter a repeated full-suite loop.","code":"REGISTRY_GATE_FAILURE","when":"The single consolidated acceptance gate fails after a substantive implementation attempt."}],"reroute":[{"action":"Create an explicit replacement task and assignment without relabeling another provider's work.","code":"ASSIGNED_SESSION_UNAVAILABLE","when":"The identified external builder cannot complete the bounded task."}],"stop":[{"action":"Stop and reject the patch.","code":"AUTHORITY_BOUNDARY_BREACH","when":"The patch writes P0/P1A/v1 facts, quantities, pricing decisions, approvals, bids, drawings, or research-provider state."}]},"correction_round":0,"created_at":"2026-09-01T18:02:00Z","created_by_profile_id":"codex-control-v1","deliverables":["Strict Division 23 v2 semantic pack contracts and compiler","Dedicated seven-table immutable SQLite EngineStore","Full-spectrum non-authoritative registry fixture","Query, reopen, projection rebuild, lineage, and integrity behavior","Packaged v2 schema and migration resources with v1 compatibility","Snapshot, rebuild-generation, and supersession-lineage hardening"],"dependency_node_ids":[],"evidence_threshold":0,"frozen_interfaces":["helios_takeoff_core.engine.v2.DOMAIN_PACK_PROTOCOL_V2","helios_takeoff_core.engine.v2.compile_domain_pack(document)","helios_takeoff_core.engine.v2.EngineStore","DefinitionKind, DomainFamily, RelationKind, DefinitionRecord, RelationRecord, CitationRecord, CompiledDomainPack, StoreIntegrityReport","Domain pack top-level fields include sources, definitions, relations and five required empty executable arrays","Pack supersession exists only through supersedes_pack_sha256","Exactly seven engine v2 user tables"],"node_type":"BuildTask","ownership":{"files":["src/helios_takeoff_core/engine/v2/__init__.py","src/helios_takeoff_core/engine/v2/contracts.py","src/helios_takeoff_core/engine/v2/compiler.py","src/helios_takeoff_core/engine/v2/store.py","src/helios_takeoff_core/engine/v2/migrations/001_engine_registry.sql","src/helios_takeoff_core/engine/v2/schemas/domain-pack-v2.schema.json","tests/test_engine_v2_registry_spine.py","tests/fixtures/engine_v2/full_division23_registry_pack.json","pyproject.toml","tests/test_package_metadata.py"],"forbidden_paths":["alembic/**","build_control/**","tools/**","src/helios_takeoff_core/migrations/**","src/helios_takeoff_core/agentic/**","src/helios_takeoff_core/engine.py","src/helios_takeoff_core/engine/*.py","src/helios_takeoff_core/database.py","src/helios_takeoff_core/repository.py","src/helios_takeoff_core/services.py"],"migrations":["engine-v2:001_engine_registry"],"modules":["helios_takeoff_core.engine.v2","helios_takeoff_core.engine.v2.contracts","helios_takeoff_core.engine.v2.compiler","helios_takeoff_core.engine.v2.store"],"path_globs":[],"public_interfaces":["helios_takeoff_core.engine.v2.DOMAIN_PACK_PROTOCOL_V2","helios_takeoff_core.engine.v2.compile_domain_pack","helios_takeoff_core.engine.v2.EngineStore"],"schemas":["helios.engine.domain-pack/v2"]},"protocol":"helios.build.task-manifest/v1","required_source_packet_ids":[],"required_source_record_ids":[],"resume_from_checkpoint_sha256":null,"roles":{"builder_profile_id":"codex-builder-v1","integrator_profile_id":"codex-control-v1","reviewer_profile_id":"codex-reviewer-v1"},"schema_impact":["Adds an isolated seven-table engine-v2 SQLite schema without changing P0 schema version 17"],"supersedes_task_manifest_sha256":null,"task_id":"division23-v2-registry-hardening-final"}