{"acceptance":{"behaviors":["A valid batch imports packets from several logical notebooks and persists immutable source and packet identities","Every packet binds to its exact exported request, notebook manifest, ATHENA profile, jurisdiction, units, and notebook","One invalid packet leaves no authoritative final batch event or partial source index","The same source across notebooks deduplicates to one canonical record while conflicting identity reuse fails closed","Exact replay is idempotent and changed content or invalid successor lineage fails closed","Precise citations and unresolved conflicts, limitations, and gaps remain visible in the builder bundle","Task preparation resolves only the frozen task's declared integrated SourcePacket dependency nodes","ATHENA has research-improvement permissions but no code, database, rule, quantity, price, approval, or bid authority","A clean runtime distribution excludes Build Fabric, research tooling, providers, and generated research artifacts"],"commands":[{"argv":["/usr/bin/env","PYTHONPATH=../src:..","python3","-m","unittest","tests.test_build_research_packets","tests.test_build_research_task_input","tests.test_build_distribution_boundary","-v"],"command_id":"ATHENA_PACKET_INTAKE_FOCUSED","cwd":"tools","expected_exit_code":0,"gate":"FOCUSED","timeout_seconds":600},{"argv":["/usr/bin/env","PYTHONPATH=../src:..","python3","-m","unittest","tests.test_build_research_packets","tests.test_build_research_task_input","tests.test_build_distribution_boundary","tests.test_build_cli","tests.test_build_graph","tests.test_build_package_boundary","-v"],"command_id":"ATHENA_PACKET_INTAKE_AFFECTED","cwd":"tools","expected_exit_code":0,"gate":"AFFECTED_INTEGRATION","timeout_seconds":600}]},"base_commit_sha":"df33f084c496ab02ac599e0c560350f00e5ecf00","budgets":{"affected_integration_seconds":600,"cost_microusd":0,"focused_test_seconds":600,"implementation_seconds":7200,"maximum_correction_rounds":1,"milestone_seconds":1200},"capability":"Build the usable multi-notebook ATHENA source-packet intake, canonical public-source registry, and task-scoped builder bundle boundary for Codex and Claude.","capability_id":"ATHENA_SOURCE_PACKET_INTAKE","checkpoint_boundaries":["RESEARCH_CONTRACTS_FROZEN","MULTI_PACKET_INTAKE_GREEN","BUILDER_BUNDLE_GREEN"],"conditions":{"block":[{"action":"Block that behavior and preserve the file-based receiving boundary.","code":"PROVIDER_OR_LOGIN_DEPENDENCY","when":"Acceptance requires NotebookLM, Grok Bot, a browser session, credentials, or a live network call."}],"escalation":[{"action":"Correct once or split the failing behavior; do not enter a repeated suite loop.","code":"RESEARCH_INTAKE_GATE_FAILURE","when":"The focused gate fails after the substantive implementation attempt."}],"reroute":[{"action":"Create an explicit replacement task and assignment without relabeling provider work.","code":"ASSIGNED_SESSION_UNAVAILABLE","when":"The identified external builder cannot complete the bounded task."}],"stop":[{"action":"Stop and reject the patch.","code":"AUTHORITY_BOUNDARY_BREACH","when":"The patch writes runtime/P0/P1A facts or grants ATHENA code, rule, quantity, price, approval, or bid authority."}]},"correction_round":1,"created_at":"2026-09-01T18:27:42.826325Z","created_by_profile_id":"codex-control-v1","deliverables":["Strict eleven-notebook manifest and bounded ATHENA profile","ResearchRequest export and atomic multi-packet SourcePacket import","Cross-notebook canonical public-source registry","Frozen task-scoped BuilderSourceBundle generation","Finite repository-local research CLI and distribution boundary"],"dependency_node_ids":[],"evidence_threshold":0,"frozen_interfaces":["ResearchRequest exports through repository-local file transport without provider calls","SourcePacket batch import validates every packet before its final authoritative event","One source identity may retain memberships in multiple logical notebooks","BuilderSourceBundle resolves only a frozen task's integrated SourcePacket dependencies","Research CLI registers through tools.helios_build.cli.register_command","Research tooling and artifacts remain absent from the runtime wheel"],"node_type":"BuildTask","ownership":{"files":["build_control/schemas/notebook-manifest-v1.schema.json","build_control/schemas/athena-worker-profile-v1.schema.json","build_control/schemas/research-request-v1.schema.json","build_control/schemas/source-record-v1.schema.json","build_control/schemas/source-packet-v1.schema.json","build_control/schemas/builder-source-bundle-v1.schema.json","build_control/worker_profiles/athena.v1.json","build_control/worker_profiles/athena.instructions.v1.md","build_control/source_registry/notebooks.v1.json","build_control/source_registry/README.md","tools/helios_build/source_registry.py","tools/helios_build/research.py","tools/helios_build/cli.py","tests/test_build_research_packets.py","tests/test_build_research_task_input.py","tests/test_build_distribution_boundary.py"],"forbidden_paths":["src/**","alembic/**","pyproject.toml","build_control/graph/**","build_control/tasks/**","build_control/source_packets/**","build_control/builder_source_bundles/**","build_control/source_registry/sources/**","build_control/source_registry/imports.jsonl"],"migrations":[],"modules":["tools.helios_build.research","tools.helios_build.source_registry"],"path_globs":[],"public_interfaces":["tools.helios_build.research.export_research_request","tools.helios_build.research.import_source_packets","tools.helios_build.research.prepare_task_source_bundle","tools.helios_build.source_registry.SourceRegistry"],"schemas":["helios.build.notebook-manifest/v1","helios.build.athena-worker-profile/v1","helios.build.research-request/v1","helios.build.source-record/v1","helios.build.source-packet/v1","helios.build.builder-source-bundle/v1"]},"protocol":"helios.build.task-manifest/v1","required_source_packet_ids":[],"required_source_record_ids":[],"resume_from_checkpoint_sha256":null,"roles":{"builder_profile_id":"codex-builder-v1","integrator_profile_id":"codex-control-v1","reviewer_profile_id":"codex-reviewer-v1"},"schema_impact":["Adds six build-control JSON contracts and zero runtime or SQLite migrations"],"supersedes_task_manifest_sha256":"8efeed58f367f6984fea4fe3d33c41e27599246011eed26c99219e04caa58979","task_id":"athena-source-packet-intake-r1a-correction-1"}