{"acceptance":{"behaviors":["The unchanged B1 empty executable pack and v1 identities remain exact","A full Division 23 executable pack compiles to order-independent canonical bytes and reopens from EngineStore with all executable indexes intact","Every rule resolves to a RULE_CANDIDATE definition and one GOVERNED_BY_RULE ontology relation","Every assembly edge resolves one allowed existing ontology relation and compilation rejects duplicate semantics, invalid dimensions, and cycles","Exact decimal and rational unit arithmetic never rounds and blocks impossible conversion or division","Missing observations or lookups produce explicit BLOCKED candidates while false conditions produce recorded deterministic omissions","Assembly traversal preserves relation paths and diamond contributions without global node deduplication","Airside/equipment and piping benchmark bundles produce deterministic cited lines spanning all Division 23 registry families","Labor and pricing remain separate non-authoritative candidates and fixture values are never represented as bid eligible","No drawing, provider, research, project, approval, quote, or bid authority enters B2"],"commands":[{"argv":["/usr/bin/env","PYTHONPATH=../src:..","python3","-m","unittest","tests.test_engine_v2_calculation_assembly","-v"],"command_id":"DIV23_V2_CALCULATION_ASSEMBLY_FOCUSED","cwd":"tools","expected_exit_code":0,"gate":"FOCUSED","timeout_seconds":600},{"argv":["/usr/bin/env","PYTHONPATH=../src:..","python3","-m","unittest","tests.test_engine_v2_calculation_assembly","tests.test_engine_v2_registry_spine","tests.test_engine_domain_pack_compiler","tests.test_engine_domain_pack_repository","tests.test_engine_evaluator","tests.test_package_metadata","-v"],"command_id":"DIV23_V2_CALCULATION_ASSEMBLY_AFFECTED","cwd":"tools","expected_exit_code":0,"gate":"AFFECTED_INTEGRATION","timeout_seconds":600}]},"base_commit_sha":"6535fb2e99ae3f148c867433c2c610d863930e22","budgets":{"affected_integration_seconds":600,"cost_microusd":0,"focused_test_seconds":600,"implementation_seconds":10800,"maximum_correction_rounds":1,"milestone_seconds":1200},"capability":"Build a deterministic source-cited Division 23 calculation and assembly kernel for structured benchmark inputs across equipment, duct, pipe, fittings, valves, accessories, materials, connections, insulation, supports, labor, and pricing.","capability_id":"DELIVERABLE_B_DIV23_CALCULATION_ASSEMBLY","checkpoint_boundaries":["EXECUTABLE_PACK_COMPILED","FORMULA_EVALUATOR_GREEN","ASSEMBLY_KERNEL_GREEN"],"conditions":{"block":[{"action":"Block acceptance and preserve explicit benchmark-only limitations.","code":"PRODUCTION_PRICE_CLAIM","when":"Benchmark fixture labor or pricing data is described as production-authoritative or bid eligible."}],"escalation":[{"action":"Report the exact failing behavior and perform at most one narrow correction; do not enter a repeated full-suite loop.","code":"CALCULATION_GATE_FAILURE","when":"The single consolidated focused gate fails after substantive implementation."}],"reroute":[{"action":"Create an explicit replacement assignment without relabeling another provider's work.","code":"ASSIGNED_SESSION_UNAVAILABLE","when":"The identified external builder cannot complete the bounded task."}],"stop":[{"action":"Stop and reject the patch.","code":"AUTHORITY_BOUNDARY_BREACH","when":"The patch writes P0 or P1A state, drawings, quantities, project prices, approvals, quotes, bids, provider state, or research state."},{"action":"Stop and replace the behavior with exact closed deterministic evaluation.","code":"NONDETERMINISTIC_EVALUATION","when":"Evaluation uses float, rounding, latest-pack lookup, callbacks, network, environment, filesystem, commands, or unbounded expressions."}]},"correction_round":0,"created_at":"2026-09-01T18:31:00Z","created_by_profile_id":"codex-control-v1","deliverables":["Closed bounded exact-arithmetic formula evaluator","Typed observation bundle compiler","Relation-bound deterministic assembly resolver","Source-cited non-authoritative result-set compiler","Airside/equipment and piping benchmark fixtures spanning every Division 23 family","Executable-pack store reopen and integrity validation"],"dependency_node_ids":[],"evidence_threshold":0,"frozen_interfaces":["OBSERVATION_BUNDLE_PROTOCOL is helios.engine.observation-bundle/v1","RESULT_SET_PROTOCOL is helios.engine.result-set/v1","All outputs carry CandidateAuthority.NON_AUTHORITATIVE_CANDIDATE","B2 accepts BundleMode.BENCHMARK and rejects PROJECT_BOUND","CompiledDomainPack indexes units, observation definitions, lookups, assembly edges, and rules","Assembly edges bind existing relation_code values and do not duplicate ontology endpoints","Evaluation requires one explicit immutable CompiledDomainPack and never resolves latest","No float, rounding, external callback, provider, filesystem, command, environment, or URL evaluation"],"node_type":"BuildTask","ownership":{"files":["src/helios_takeoff_core/engine/v2/__init__.py","src/helios_takeoff_core/engine/v2/contracts.py","src/helios_takeoff_core/engine/v2/compiler.py","src/helios_takeoff_core/engine/v2/store.py","src/helios_takeoff_core/engine/v2/schemas/domain-pack-v2.schema.json","src/helios_takeoff_core/engine/v2/formulas.py","src/helios_takeoff_core/engine/v2/evaluator.py","src/helios_takeoff_core/engine/v2/schemas/observation-bundle-v1.schema.json","tests/test_engine_v2_registry_spine.py","tests/test_engine_v2_calculation_assembly.py","tests/test_package_metadata.py","tests/fixtures/engine_v2/full_division23_calculation_pack.json","tests/fixtures/engine_v2/airside_equipment_bundle.json","tests/fixtures/engine_v2/piping_bundle.json"],"forbidden_paths":["alembic/**","build_control/**","tools/**","src/helios_takeoff_core/migrations/**","src/helios_takeoff_core/agentic/**","src/helios_takeoff_core/database.py","src/helios_takeoff_core/repository.py","src/helios_takeoff_core/services.py","src/helios_takeoff_core/engine/v2/migrations/**"],"migrations":[],"modules":["helios_takeoff_core.engine.v2","helios_takeoff_core.engine.v2.contracts","helios_takeoff_core.engine.v2.compiler","helios_takeoff_core.engine.v2.formulas","helios_takeoff_core.engine.v2.evaluator","helios_takeoff_core.engine.v2.store"],"path_globs":[],"public_interfaces":["helios_takeoff_core.engine.v2.compile_observation_bundle","helios_takeoff_core.engine.v2.evaluate_formula","helios_takeoff_core.engine.v2.evaluate_bundle","helios_takeoff_core.engine.v2.resolve_assembly"],"schemas":["helios.engine.domain-pack/v2","helios.engine.observation-bundle/v1","helios.engine.result-set/v1"]},"protocol":"helios.build.task-manifest/v1","required_source_packet_ids":[],"required_source_record_ids":[],"resume_from_checkpoint_sha256":null,"roles":{"builder_profile_id":"codex-builder-v1","integrator_profile_id":"codex-control-v1","reviewer_profile_id":"codex-reviewer-v1"},"schema_impact":["Extends canonical domain-pack-v2 executable arrays and adds an observation-bundle-v1 schema without adding or changing database tables"],"supersedes_task_manifest_sha256":null,"task_id":"division23-v2-calculation-assembly-kernel"}